{
  "bestatt": true,
  "krav_id": "m39-ytelse-v1",
  "maalt": {
    "feilet": false,
    "kjoringer": [
      0.0223,
      0.0185,
      0.0233
    ],
    "per_kjoring": [
      {
        "lukkede": 0,
        "nye": 0,
        "oppdaterte": 6,
        "tenanter": 3
      },
      {
        "lukkede": 0,
        "nye": 0,
        "oppdaterte": 6,
        "tenanter": 3
      },
      {
        "lukkede": 0,
        "nye": 0,
        "oppdaterte": 6,
        "tenanter": 3
      }
    ],
    "sekunder": 0.0233,
    "sekunder_per_tenant": 0.0078,
    "tenanter": 3
  },
  "oppsett": {
    "bevisrot_sha256": "7b1b8435450c63741b0aec5683b327b0f5c0be269ef11cca36e29f980cbfc817",
    "modul": "m39_lonnsgrunnlag",
    "sveip": "lonnssveip",
    "vert": "cloud-server-10605510"
  },
  "ts": "2026-09-18T06:05:42.272668+00:00"
}
